<!ELEMENT employees (employee+)>
<!ELEMENT employee (employeeno, employeename, deptname, salary, yearofjoin)>
<!ELEMENT employeeno (#PCDATA)>
<!ELEMENT employeename (#PCDATA)>
<!ELEMENT deptname (#PCDATA)>
<!ELEMENT salary (#PCDATA)>
<!ELEMENT yearofjoin (#PCDATA)>